{"base_label":"DEMO","coverage":{"status":"demo","through":"DEMO Qualifying Final (replay)"},"demo":true,"forecast":{"artifact":"predictions/2026/r05.json","model_id":"demo_model_v1","reason":null,"status":"available"},"generated_at":"2026-09-25T00:00:00Z","release_id":"20260925T000000Z-demo","resources":{"accuracy_index":{"bytes":509,"path":"accuracy/index.json","sha256":"60eaac5744cae32ab5fed4b9a339bb737eb6eeef012602955a1e49c93854ff67"},"article_index":{"bytes":1142,"path":"articles/index.json","sha256":"b5c103d6346a3ec277ee21a3207e286cae5935cc117122599cf3d163c904797e"},"downloads":{"bytes":1695,"path":"downloads.json","sha256":"d4584283ddec15c1575797f9beb4c34697df87110a1412418570484d253784a1"},"history_index":{"bytes":738,"path":"history/index.json","sha256":"e1d28ed8200d9757c8c7aad93d5efae59c3b8f18dd45240b0be8ad585f4ca61f"},"lists_index":{"bytes":58,"path":"lists/index.json","sha256":"04a40790e872524bd8095652a090cd06bc61a38063dcd9f262bef4af99e4373e"},"live_index":{"bytes":530,"path":"live/index.json","sha256":"5e40d743c6d85eab23985643a5b6729d9fa2e9eb13f4d2b5b64386edf96cfc70"},"match_index:1994":{"bytes":525,"path":"matches/1994/index.json","sha256":"c24bf834a0aa34eb37269c2faae644eb6e75a8ca1c1ff49dab5cd9efd907ac5a"},"match_index:2025":{"bytes":972,"path":"matches/2025/index.json","sha256":"8d5fc533712a5c26b3929e8fe544e5eade5dd649d9583959348af6f28efe16ee"},"match_index:2026":{"bytes":4975,"path":"matches/2026/index.json","sha256":"295c1c36d10dfc27dcd8ad84040a29cd25a57e9a4a8169fd5f2532be9563a35e"},"overview":{"bytes":7851,"path":"overview.json","sha256":"a7018f1e736a1c2522d5c76b5b45ea0efd07090043cdaa77a566eeacb412e830"},"player_index":{"bytes":14611,"path":"players/index.json","sha256":"455c4a97a45747a6dbcbf0872a9195c06d1965b6dbe031faf7bbb799e4129b42"},"prediction_index":{"bytes":354,"path":"predictions/index.json","sha256":"21fd11b3488f4fbd8cb38fc910238c0b416d57a45657ebeb3e0e866eeab4c554"},"quality":{"bytes":595,"path":"quality.json","sha256":"58471d45994f4e037e003e7388c29ae0b2d77e12117b593ae65d858c7b6ed502"},"team_index":{"bytes":762,"path":"teams/index.json","sha256":"11a223a0847c76505f33b27e3a7426021e81b3fccfd0ccd106a54143c8ea0494"}},"schema_version":1,"season":2026,"snapshot_id":"demo-snapshot-0001"}
